{"$schema":"https://json-schema.org/draft/2020-12/schema","type":"object","additionalProperties":false,"required":["repository","facts","inferences","risks","blockers","unknowns","evidence_refs","exploration_metrics"],"properties":{"repository":{"type":"string"},"facts":{"type":"array"},"inferences":{"type":"array"},"risks":{"type":"array"},"blockers":{"type":"array"},"unknowns":{"type":"array"},"evidence_refs":{"type":"array","items":{"type":"string"}},"exploration_metrics":{"type":"object"}}}
